{
  "slug": "saturn-ethereum-2026-06-24",
  "protocol": "Saturn Credit",
  "protocolSlug": "saturn-credit",
  "chain": "Ethereum",
  "auditDate": "06/24/2026",
  "complexityTier": "Moderate",

  "securityScore": 68.4,
  "securityGrade": "B",
  "riskLevel": "Medium",
  "dealBreakers": "0 Failed — Gate cleared",

  "dealBreakerGate": "Conditional",

  "findingsSummary": "This is the full scored assessment that the April run never produced — that pass halted at the deal-breaker gate. The three April access-control deal breakers are now resolved by a 5-day TimelockController migration (verified on-chain), and the implementations are byte-identical to April, so no code re-audit was triggered. Saturn is well-engineered — modern OpenZeppelin v5.x, comprehensive reentrancy protection, ERC4626 inflation defense, internal-accounting NAV, and three prior audits — with no Critical/High code vulnerability and no unprivileged drainable path. The score lands at the B band (68.4, a B+ at the bottom of the band) because of structural trust concentration rather than code defects: 92.5% of the $88.6M vault NAV is off-chain STRC credited by a non-timelocked single-key processor that can move the liquid balance within a ±20% tolerance, the 5-day timelock's sole proposer/canceller is still a single EOA, a slow 24h-heartbeat single oracle prices the off-chain NAV, and there is no bug bounty. The team is publicly doxxed.",

  "keyFindings": [
    "April's 3 access-control deal breakers resolved — upgrade authority now behind a 5-day TimelockController",
    "92.5% of the $88.6M vault NAV is off-chain STRC credited by the processor — not provable on-chain",
    "Non-timelocked single-key processor can move the liquid USDat balance within a ±20% tolerance, uncapped",
    "The 5-day timelock's sole proposer/canceller is still a single EOA — delay without decentralization",
    "Slow single oracle (24h-heartbeat Chainlink STRC feed) prices 92.5% of NAV; no fallback",
    "No bug bounty / security contact; team is publicly doxxed (Kevin Li, Ellis Osborn, Seb)"
  ],

  "dealBreakerSummary": { "pass": 17, "fail": 0, "na": 5, "inconclusive": 1 },

  "dealBreakerDetails": [
    { "item": "EOA Upgrade Control",            "status": "PASS", "category": "Access Control & Governance", "evidence": "Was FAIL in April. Upgrade authority on all 4 core contracts now terminates at a 5-day TimelockController (0xfD57…8A67, minDelay 432000s). UUPS _authorizeUpgrade = onlyRole(DEFAULT_ADMIN_ROLE) = timelock; USDat ProxyAdmin owner = timelock. Old EOA fully revoked." },
    { "item": "EOA Fund Control",               "status": "PASS", "category": "Access Control & Governance", "evidence": "Was FAIL in April. No single EOA can upgrade-to-drain; the upgrade path is 5-day-timelock-gated. The processor's convertFromUsdat is the intended conversion mechanism within ±20% tolerance with an off-chain backing obligation — scored as a Fund Control / economic weakness (§2.2, F-2), not an unrestricted EOA withdrawal." },
    { "item": ">60% Governance Centralization", "status": "N/A",  "category": "Access Control & Governance", "evidence": "No governance token." },
    { "item": "Governance Mechanism Bypass",    "status": "N/A",  "category": "Access Control & Governance", "evidence": "No on-chain voting." },
    { "item": "Timelock Backdoors",             "status": "PASS", "category": "Access Control & Governance", "evidence": "Was FAIL in April. Timelock executor = address(0) (open), admin = self; no fastTrack/emergencyExecute. 5d ≫ 48h mainnet minimum. Mint/Redeem under a separate 72h timelock. updateOracle now timelock-gated." },
    { "item": "No Emergency Controls",          "status": "PASS", "category": "Access Control & Governance", "evidence": "Pause via COMPLIANCE_ROLE; unpause via DEFAULT_ADMIN_ROLE (timelock)." },

    { "item": "Direct Pool Price Oracle",       "status": "PASS", "category": "Oracle & Price Integrity",     "evidence": "Chainlink STRC feed wrapped with staleness + bounds; not a DEX spot price." },
    { "item": "Manual Price Control",           "status": "PASS", "category": "Oracle & Price Integrity",     "evidence": "No direct price setter; updateOracle / setPriceBounds are now 5-day-timelock-gated." },

    { "item": "Known Compiler Bugs",            "status": "PASS", "category": "Smart Contract Architecture",  "evidence": "Solidity 0.8.20 / 0.8.26, no applicable CVE." },
    { "item": "No Reentrancy Protection",       "status": "PASS", "category": "Smart Contract Architecture",  "evidence": "OZ ReentrancyGuard + CEI; SwapFacility transient-storage lock." },
    { "item": "Unlimited Minting",              "status": "PASS", "category": "Smart Contract Architecture",  "evidence": "USDat mints only by wrapping M 1:1 (onlySwapFacility)." },
    { "item": "Unsafe Delegatecall / Call",     "status": "PASS", "category": "Smart Contract Architecture",  "evidence": "No delegatecall or unvalidated .call{} in Saturn contracts." },
    { "item": "Uninitialized Implementation",   "status": "PASS", "category": "Smart Contract Architecture",  "evidence": "All implementations call _disableInitializers()." },
    { "item": "Unprotected Initializer",        "status": "PASS", "category": "Smart Contract Architecture",  "evidence": "initializer-gated; already initialized on-chain." },

    { "item": "No Audit + High TVL",            "status": "PASS",         "category": "Audit & Verification", "evidence": "3 audits (Three Sigma + 2× Certora); TVL ~$88.6M, audited." },
    { "item": "Unverified Contracts",           "status": "PASS",         "category": "Audit & Verification", "evidence": "10/10 in-scope contracts verified on Etherscan (100%)." },
    { "item": "Critical Unfixed Issues",        "status": "Inconclusive", "category": "Audit & Verification", "evidence": "Audit PDFs not re-read this pass (per process)." },

    { "item": "Zero Flash Loan Protection",     "status": "PASS", "category": "Economic & Liquidity",         "evidence": "Was Inconclusive in April. Internal-accounting NAV + async withdrawal + vesting break same-block manipulation." },
    { "item": "Broken Tokenomics",              "status": "PASS", "category": "Economic & Liquidity",         "evidence": "Was Inconclusive in April. ~11% real yield from off-chain STRC, well below 100%; not emission-driven." },
    { "item": "No Slippage Protection",         "status": "PASS", "category": "Economic & Liquidity",         "evidence": "depositWithMinShares, mintWithMaxAssets, requestRedeem(minUsdatReceived)." },

    { "item": "Centralized Bridge",             "status": "N/A", "category": "Cross-Chain & Bridges",          "evidence": "Single chain (Ethereum only)." },
    { "item": "No Transfer Limits",             "status": "N/A", "category": "Cross-Chain & Bridges",          "evidence": "Not a bridge." },
    { "item": "No Token Verification",          "status": "N/A", "category": "Cross-Chain & Bridges",          "evidence": "Not a bridge." }
  ],

  "adminControlMatrix": [
    {
      "surface": "USDat / sUSDat / Withdraw / StrcPriceOracle — Upgrade & DEFAULT_ADMIN",
      "controller": "0xfD5782E3BFF366601da3973aE30C583dE4F08A67",
      "controllerType": "Timelock",
      "delayHours": 120,
      "worstCase": "Upgrade any core contract or change the oracle/params — but only after a public 5-day delay (the canonical exit window)"
    },
    {
      "surface": "TimelockController — PROPOSER & CANCELLER",
      "controller": "0x610182581C93687Ca03F4a8E7f124f8cEC616820",
      "controllerType": "EOA",
      "delayHours": 0,
      "worstCase": "Sole proposer and canceller: can queue a 5-day-delayed malicious upgrade, indefinitely cancel remediation, or freeze admin if the key is lost"
    },
    {
      "surface": "sUSDat — PROCESSOR_ROLE (convertFromUsdat)",
      "controller": "Processor key (single EOA, non-timelocked)",
      "controllerType": "EOA",
      "delayHours": 0,
      "worstCase": "Move the liquid USDat balance via convertFromUsdat within a ±20% tolerance, uncapped and repeatable; off-chain STRC backing (92.5% of NAV) is not on-chain-provable"
    },
    {
      "surface": "USDat — COMPLIANCE_ROLE",
      "controller": "Compliance key (hot key)",
      "controllerType": "EOA",
      "delayHours": 0,
      "worstCase": "Freeze accounts, arbitrary-recipient forceTransfer, manage the whitelist, and both pause and unpause USDat"
    },
    {
      "surface": "Mint/Redeem (SwapFacility) — Proxy upgrade",
      "controller": "0x23CA665c8a73292Fc7AC2cC4493d2cE883BBA468",
      "controllerType": "Timelock",
      "delayHours": 72,
      "worstCase": "Mint/Redeem upgrade — 72h public delay before exposure"
    },
    {
      "surface": "Chainlink STRC Feed — Owner",
      "controller": "0x21f73D42Eb58Ba49dDB685dc29D3bF5c0f0373CA",
      "controllerType": "Multisig",
      "multisigConfig": "4/9",
      "delayHours": 0,
      "worstCase": "Replace the underlying Chainlink STRC price-feed implementation"
    }
  ],

  "openIssues": [
    {
      "issue": "Timelock's sole PROPOSER + CANCELLER is a single EOA (F-1)",
      "category": "Access Control",
      "severity": "Medium",
      "impact": "Delay without decentralization: key loss freezes admin (incl. unpause); key compromise can propose a malicious upgrade (5-day window) or indefinitely cancel remediation",
      "recommendation": "Move PROPOSER/CANCELLER to a ≥3/5 multisig with an independent canceller",
      "priority": "P1",
      "timeline": "1 month"
    },
    {
      "issue": "Non-timelocked single-key processor can move the liquid USDat balance via convertFromUsdat (F-2)",
      "category": "Access Control",
      "severity": "Medium",
      "impact": "The processor can move the entire liquid USDat balance within a ±20% tolerance, uncapped and repeatable; off-chain STRC backing (92.5% of NAV) is not on-chain-provable",